{"checks":[{"evidence":[],"id":"workflow.novel-status","status":"pending"},{"evidence":[],"id":"workflow.novel-init","status":"pending"},{"evidence":[],"id":"workflow.novel-context","status":"pending"},{"evidence":[],"id":"workflow.novel-write","status":"pending"},{"evidence":[],"id":"workflow.novel-review","status":"pending"},{"evidence":[],"id":"workflow.novel-commit","status":"pending"},{"evidence":[],"id":"terminal.doctor","status":"pending"},{"evidence":[],"id":"terminal.compatibility-matrix","status":"pending"},{"evidence":[],"id":"terminal.branch-create","status":"pending"},{"evidence":[],"id":"terminal.rollback","status":"pending"},{"evidence":[],"id":"terminal.export-repeat","status":"pending"}],"executed_at":"REPLACE_ME","ide_version":"REPLACE_ME","operator":"REPLACE_ME","operator_attestation":"I personally executed these checks in the named vendor IDE runtime.","os":"REPLACE_ME","schema_version":"ide-live-attestation-input.v1","template_hash":"sha256:4a0c9e3c50eb01dd58950905d6218d8aa86c6ad75e11fbd1173fc3bee10bc6e9","vendor":"antigravity"}